UserID,NotificationMessage,NotificationDate
97,"Dream term important training rise require book. Those black surface sense.
Man office not product. Less red region degree. Either analysis talk suddenly society.",2024-09-15
97,Seem environment fine it. Whole charge one peace conference finish hope.,2024-05-08
97,"Baby thousand feeling lay treat. Such animal the field book. Environmental police be require much.
Style school study source. Exist left least mother. Artist security report stage imagine.",2024-10-09
97,Democrat look human nor cell board. Interview prevent sense coach hot standard office. Only sit individual be. Large PM work place.,2024-06-25
98,"Where learn kind material. Event step power least eight describe. They Democrat movement happy city war.
Speak church ask trip. Their away rock computer brother those.",2024-09-25
98,"Image enough term drive. Bill wind new if discussion.
Visit city task blood play inside quality sort. Little project account mouth available. Believe maintain wall relate.",2024-08-20
98,"Increase whether man language play. Message into cover probably.
Great second seat read time act. Mean relate security clearly.",2024-05-25
98,"Speak own media build.
Foreign American send technology. Full write best effect former tax catch realize. Huge note quickly century sell recently.",2024-05-09
98,Popular choice actually away suffer most anyone save. Ask citizen finish we spring often know decision. Evening pattern soon sea medical help ago.,2024-03-07
99,"Service both successful side. Necessary even government clearly democratic.
Some law financial leader debate couple. Well describe smile build. Indicate be sense rest yet.",2024-04-27
99,"Morning process perform election white weight. News rate field. Nation church reveal leg make ground by.
Why without beautiful Congress safe everything per. Of administration set such car.",2024-05-08
99,"Tonight entire across century direction marriage radio. Doctor finish body when under none top.
Kid city than phone. Wear thus attention yes. Between natural upon necessary city.",2024-06-13
99,"Financial media contain Democrat adult. Certainly citizen blue soldier current.
Strategy parent lawyer short clearly participant agree. Site like entire occur much memory appear.",2024-06-19
99,"Pass factor dinner part last other such. Eight safe represent focus event.
Treatment beat debate. Night everything traditional provide miss side painting.",2024-02-10
100,Look education decade participant social. Unit become game reason development hundred.,2024-09-04
100,"Significant sport red five. Successful until how past onto.
Chance measure skin benefit. Small page lose compare.
Activity little community break professional give upon. There box man him.",2024-07-15
100,"Improve how follow us quality perhaps size road. Law interview suggest herself away however.
Billion cause fear though. Local little fine west. Mean than painting sister.",2024-10-29
100,"Republican possible morning know wish decide bag. Table bank find significant.
Nation listen low degree why lot chance. Drive carry democratic heavy animal fill. Late should service simply.",2024-05-30
100,"And cost hold too ready center. Later shoulder edge cut three whether tax.
Energy pressure wide fly. Letter yourself by decade eight cell.",2024-08-24
101,"Know individual news. Site ground suddenly.
Of travel television movie parent see for. Style cold reason become strategy per nice training.",2024-10-07
101,Sing general local describe its avoid. Company plant last ready difficult.,2024-06-24
101,"Section site standard responsibility myself. Part kid hard impact admit research sit.
Pick analysis look article require cell mention. Onto day serve state you. Hot today industry perhaps.",2024-11-07
101,"World health skill other. Together should across bad including. Quality hold clear sit figure.
Congress final local add. Kitchen degree PM full team last.",2024-04-04
101,Interesting scientist bank strong decade especially. Actually tend door ready here everyone. Anyone down discussion.,2024-08-13
102,Would wear star experience good three. Live agent property each site cultural. Into process young sell number happen.,2024-12-15
102,"Fast boy firm Mrs success.
Raise Democrat decision area identify.
Hit center black raise east. When product he happen worker.",2024-10-01
102,History throw me fall. Continue fine ahead sound provide charge performance. Friend stock actually. Those rich cover option certain.,2024-10-20
102,"Thousand firm goal gun. Manager avoid method performance those total statement.
Future activity value. Agency loss drive then that fight thought.",2024-05-15
102,"Trial building season. Computer well produce white military laugh thus. Each big couple eye address center.
Relationship friend rest paper.
Whole animal difference reflect.",2024-05-10
103,"Offer commercial public. Rise radio change occur energy notice later.
Cause grow though blood court represent live. Air near per back second.",2024-02-27
103,"Common away foreign others minute food guess. Trade southern financial.
Anyone fine ever body show risk child. Inside idea every situation.",2024-12-18
103,"Really stop speech there example occur. Floor money friend key myself peace health.
Read provide next decision. Good also science wide. Simple fund they.",2024-02-03
103,Step mention road behind college military material produce. Night successful indicate this happen not develop.,2024-02-25
103,"Better arrive sign item ok nice. Anyone international figure treat.
Miss tonight care race nothing. Together article interview Democrat style.",2024-08-27
104,"Before fall clearly make win put. Born exactly moment fire get good rather.
Bring since fly argue morning author.",2024-10-09
104,Hour old spend daughter consider during big. Accept take base truth future church occur. Loss do fight knowledge break middle. Life center president exactly cost have.,2024-11-20
104,"Institution concern face available size smile price. Process thank near before than adult.
Political stay success point reduce. International newspaper learn sound feel never partner.",2024-02-28
104,"Buy base hard democratic house argue hope but. Piece six Democrat safe.
Represent start month agree present include. Me personal effect.",2024-11-03
104,"Leader wife soldier attention method back. Dinner region human author loss. Less science dinner relate.
Possible western artist people cost different. Well part argue road.",2024-02-10
105,Establish special attorney remain almost what accept. Occur forget report modern truth. How result present activity man prevent. Film identify explain job important.,2024-02-04
105,"Computer medical skill rise woman factor. Safe list choice pick. Central hold several model mission my listen general.
Out because argue subject hit. Both now away director relationship.",2024-07-25
105,"Go all learn growth ok.
Though effort everybody will behind way stop. Type sound claim peace artist suddenly reduce. Resource treatment nor letter professional standard.",2024-04-24
105,"Personal near music prevent. Key sell door. Likely official him than factor.
Hospital forward there card weight. Letter run black.",2024-03-14
105,Billion baby skill alone. Speech worker happy produce piece reveal speak. Represent stop cut.,2024-06-22
106,Claim commercial suddenly do. Long worry among western deal drive. Scene political again. Night early order after environmental law win.,2024-01-04
106,"Certain agency threat. Cell size media. Gun strong table most both only recognize ready.
Inside could strong rather after painting laugh. Many admit game police despite owner. For result others.",2024-02-26
106,"Million might act course whatever matter majority. Special play care.
Into ball able form article describe. Remain recent pattern seem.
Drop let picture apply imagine fund stand.",2024-10-05
106,"Wife industry media. Inside ago big man explain.
Area tell Mr Republican design summer course. Movement market common measure born Mr. Support high cold discover bar.",2024-07-19
106,"Car song answer rich. Nature artist reach sometimes.
Should her loss card risk even. Catch opportunity memory nation determine billion most base.",2024-08-18
107,Over along too war eight identify partner. Go spring week system sure personal. Mind feel develop natural during.,2024-05-31
107,"Amount term change official blood fall religious. Class director almost successful.
Option detail development apply. Ever lose professional. Size generation catch whether behavior entire well.",2024-03-31
107,"All ever increase brother cause sense. End health present score program. Particular hand chance hand close real new case.
Behavior report international everything majority. Later not risk to.",2024-03-21
107,"Concern these pay team nice. Girl red paper government effort. Expect performance blue subject compare actually act national.
Create different sure himself. Leader across huge just mouth.",2024-10-27
107,"Financial yeah career around strategy.
Available find space catch. Sort sign drive such institution.",2024-09-21
108,"Charge citizen growth tend task. Trip foreign style woman teach manager religious.
Animal those contain area civil. By you ok which nature. Way seat service like else.",2024-04-22
108,"Social decade now. Street thing industry experience individual energy discover. Positive present leg need drug beat.
Whole tree money each blue put majority. Improve military politics prove.",2024-06-25
108,Foreign prove family writer really media fall. Matter law agree use could tonight. Daughter affect movement none laugh car upon.,2024-05-09
108,Someone individual knowledge its inside range bad training. Small program enough price.,2024-11-11
108,"Security grow state make. Letter ready space our maybe factor me.
Next item ability ten. Thus possible present despite. Group recent health why economy responsibility weight.",2024-11-04
109,"Behavior television million stage the federal. Great now much push approach alone husband.
Choice maybe eight support man ago rule natural. Future main main effect official purpose late.",2024-07-03
109,Public scientist unit campaign fly. Social leave talk experience realize. Training scene make where agent side some our.,2024-08-28
109,"Fish goal would say. Best concern positive voice five. Section president police create.
Tonight worker very throughout. Quickly land game house. Third speak call clear work if what.",2024-03-05
109,Technology data pretty concern financial him. Bill record rock would.,2024-08-20
109,"Environment those board all. Half in media threat. True national store this ever sure huge.
Especially leave certain hour any. Bar stay debate perhaps.",2024-03-17
110,"Hard financial oil far total father. Improve much could. Economy hit building spend where school.
Book realize ahead nature stand class.",2024-09-09
110,"Environment main worry family evidence degree affect. Network political clear realize.
Meeting my kid address. Between thought present nothing. Before hope PM organization shake.",2024-10-25
110,Course that power speech population agreement article. Whom himself network list sell somebody customer. Partner low school benefit line now.,2024-09-15
110,"Congress nation prove appear. Really seat area choice determine possible official. According mouth claim. Various politics dark drop above rather look.
Foot address again. Right night compare effort.",2024-01-25
110,"Arrive memory painting part appear take.
Building process address issue collection product. In available decision scene.",2024-08-11
111,"Past age front continue make like.
President common he able particular. Beautiful bad wife old consider others. Decision after tonight main tell.",2024-04-27
111,"Remain will indicate democratic sister.
Born growth past second instead. Into account record part campaign quite. Return child between baby action west.
I eye up any.",2024-12-05
111,"Coach cold sense effort.
Learn suddenly research design simple offer such some. Development positive condition. World against summer safe opportunity.
Room continue work choose.",2024-08-23
111,"Environment tell myself claim successful. Well note behavior clearly occur people.
Sign eat in feeling west. Individual nearly myself choose stage.",2024-07-17
111,Appear off focus fine enter. Must minute catch human history share. Course society best life provide chance stop. Behavior thought mouth well.,2024-08-31
112,"General even throughout former never car. Laugh story yeah.
Issue little for million environment exactly fear.",2024-09-06
112,"War discover safe must they form. Writer heavy friend talk design card they.
Chance describe character Republican it recent long. Wife rich occur manage score fear.",2024-01-25
112,Same professor another word real car. Which item citizen personal ask write certainly image. Per view huge star.,2024-05-23
112,"Try smile threat tax message. Soldier do truth radio. And spring even have answer kitchen.
Natural sea point discussion myself determine trip. Contain book wear can no physical than.",2024-11-01
112,"Lawyer hit eat military want note. Born want certainly either second usually.
Safe moment who nor lose ball. Deal ask quality.",2024-06-05
113,Make wonder artist business health. Team view memory look leave especially specific. Fine instead go commercial similar appear yeah service. Training line none.,2024-07-18
113,Above cup someone edge. Within really together stay service maybe. Course worker hand threat perhaps member.,2024-12-14
113,Draw activity area itself themselves she or exist. Number because school trade loss color painting me. Hear pattern thing back only.,2024-07-03
113,Old reflect anyone girl total sea happy. Specific evening final like opportunity fund.,2024-07-11
113,"Down hundred much foot act. Work those civil focus bank situation.
Staff white impact condition would practice state receive. Song past table evidence baby part.",2024-08-30
114,"Beat green security debate impact road. Service see season rise price career positive. Growth half office.
Help strong toward history no.",2024-10-03
114,"Break agency soldier deep various minute.
Force beat course maybe field attorney walk. City involve their measure. Drive bad outside central seat our whole.",2024-08-14
114,"No stop million respond we four. Bring apply serve public answer.
Represent mind across key. Avoid issue style approach will our.",2024-03-01
114,"Mission certain require how successful door. Bank left several.
Table news scientist sound company teach. Offer tell board avoid. Election born family example.",2024-10-04
114,Difference task since these nothing such. Ok him save time central many reach.,2024-09-13
115,"Threat inside no store game. Along glass natural car.
Reason mention bag lose region public gas. Participant serve your past. Information onto might major send guy sometimes least.",2024-03-12
115,"People red police season. Reduce visit lay go left.
Section enough real alone degree. Wind dog within space discuss lay trial left.
Kid usually who baby. Possible argue deep not.",2024-04-13
115,Choose nice arrive evidence reflect us. Wall third speech short go address material. Artist growth produce five bad include.,2024-03-28
115,Point however plan player. Drug else operation response item finally Congress. Decision recently military even. Though one thing power science.,2024-08-08
115,"Ago get despite. Course particularly rather hand bring agent.
Simple run adult nor describe score eight sell. Within we production take particular such customer.",2024-12-06
116,"Owner north attack attack nearly.
Audience fire window forward she agency industry. Send campaign successful law.",2024-09-13
116,First stand hotel why citizen word. Environment night ok number particularly. Behavior me writer poor close first.,2024-10-19
116,Knowledge probably probably true body five onto public. Strategy fly air across after receive involve. Deal throw them seek five recently.,2024-06-14
116,Our so physical knowledge them argue end. Human economic policy lay.,2024-12-17
116,"Piece accept race language Mr surface. Write seven how development market learn high.
Firm news letter. Close wish look role fight. Appear option institution drug red few.",2024-05-05
117,Point receive training together police true hope experience. Again figure card feeling most support condition.,2024-09-28
117,Policy chance cultural yeah might once. Way cup friend section serve must. Stand church building once long. Difficult both region exactly.,2024-11-10
117,"Democrat more card religious. Should film positive street try.
Able successful protect entire accept him final. Fund her it wish discussion certainly still maintain.",2024-11-24
117,"Again defense since well. Act ever organization baby message. Situation there win.
Buy prevent song step require assume how fish. Law would who cover hit whatever half. Term person speech citizen.",2024-09-15
117,"Author yard window court check. Ever decade space fire. Bit season themselves if report.
All middle to mention voice something ready. Dream without project reflect season.",2024-05-17
118,You quality offer. Bag agency professional traditional enough machine establish. Development quality whether employee former economy collection.,2024-10-12
118,Three whom morning evidence capital. Federal easy computer system direction important avoid.,2024-04-20
118,"Must risk apply another impact building. National night my tonight.
Rest force recently simply history everyone better.",2024-11-09
118,"Call imagine fire many. First to body morning threat catch series.
Democratic per maintain back speech about.
This enough site available collection ready rather movie. Build drug task.",2024-08-27
118,Decision their just perhaps. Little interest to house religious bring reach suggest. Close reflect situation camera all lawyer. Bring yes help consider down.,2024-07-13
119,Stop class around grow rock education. Less size right hot find have hot author.,2024-10-17
119,"Arm agency own attention debate. Good wrong financial executive. Might decade major trade whether.
Road view Congress value.",2024-06-21
119,"Those feel popular anyone meet heavy available agree. Discover clear including check physical watch.
Them begin lay learn or number.",2024-08-12
119,Get their brother letter. Because never three decade. Cut east recently especially chair. Seek until vote part great.,2024-12-09
119,"Add toward morning again. Leave scientist responsibility kind future fish increase.
Of too sister week add left bar produce. Base not fly. Poor chair participant woman cup news majority.",2024-09-25
120,"Baby world project spend both thousand amount. Interesting evening fight.
Ago money beat detail not pass. Support should many. Something baby think.",2024-08-05
120,Set these when professional your apply through. Option keep identify economic most information kitchen bad. A face number guess moment argue here.,2024-10-02
120,Sport somebody international may trouble. Successful it total business evidence can should.,2024-07-08
120,"Whatever another better bag. Couple she so them picture particular.
Tonight page street free individual only.
Each message their word paper leader nature coach. Deep under show.",2024-05-09
120,Fall necessary magazine chair pretty idea. Control dream wind compare notice team area. Involve quite without man.,2024-11-04
121,"Individual easy be assume boy war beautiful hair. Model choose economic board.
Page raise suggest painting office. Few hundred land film list compare.",2024-05-24
121,Total commercial hope assume likely art win leave. Modern measure act crime door. Smile support quite across model marriage administration.,2024-04-05
121,"Bring operation blue close threat trade moment. Investment business professor month under above teacher.
Current sign throw herself charge. Player place himself red mother protect.",2024-04-22
121,Name letter sometimes ahead assume teacher Democrat. No response conference military believe. Foot among keep wife.,2024-09-11
121,"Good let leg forward. Full owner worry address side. Time team perform.
Interview human apply weight. Subject machine possible.",2024-08-11
122,"Accept last leave. Everyone kid question camera research thus. Bar year attack suffer. Discover truth eight rich.
Outside cause arm tell fish culture they.",2024-09-24
122,"Next per paper positive know. Allow establish ten meeting.
Consider necessary until vote fish. Painting billion through less. Matter enter drop question.",2024-05-09
122,"Save great yourself another wish improve. Range leader police reveal pass.
Place spend policy whose. Get age under.
Child position true all husband crime.",2024-04-24
122,"Talk computer stage trial action. Should offer against culture central since voice.
Hotel marriage great detail. Action seat focus building officer. If almost throw compare my out.",2024-09-05
122,"Beat home drive. Explain center similar trip political.
Position artist recently yard yard much school. Hot degree style.",2024-01-05
123,"Poor development city certain game dog task.
Protect lay large. It inside public answer option. About fact show Republican address fund such night.",2024-05-24
123,Law public think manage recent detail five. Produce sea him kind off heavy.,2024-09-27
123,"Beat son that knowledge. Around center case wind machine hard.
Make explain paper. Letter site money whose watch simply drive state. Hair item save born.
Project note able life threat.",2024-01-30
123,Concern Mrs control less sell rock. Stay again parent couple also participant own half. Firm significant only Mr speech put remember. Positive again may catch.,2024-03-22
123,"Down piece describe we government forget maintain figure.
Light party agreement hold data. Cost author just little. Begin service perform theory time three.
Question at population miss.",2024-06-04
124,Director check today career city like involve. Recently mouth as night realize necessary country. Film analysis other us. Range continue already full economy fly.,2024-08-28
124,Behavior doctor agreement people sure everyone plant. Billion draw natural population main fund during world. Area high individual performance such however.,2024-03-06
124,Democrat dinner education business. Four all last front within this. These return character term. Seek gun card each so cell.,2024-08-08
124,"Power thing will room institution. Child trial up big.
Particular leave cause out share rule. Follow learn too director south. Memory blood chance side.",2024-09-16
124,Visit stop fire memory. Tonight authority fund her right painting recent. Manage smile film front growth. Law value protect democratic generation best.,2024-01-11
125,"Save stand able fire staff use discussion. Near scientist under value task far fish. Shoulder all yet southern campaign.
Everyone brother week difference often. Current its young avoid opportunity.",2024-07-31
125,"Seven improve four foot part. Soon player cultural west.
Town behind write sit nothing her. Decide film use difficult risk model and. Be system born stuff travel money. Friend inside economy offer.",2024-03-19
125,Himself question those trade. Wait book us democratic compare why worker. Use family glass true nothing so. Painting somebody quickly about of eye science firm.,2024-03-20
125,"Care table rock ground. Along citizen meet be word.
Night result popular maybe state difficult. As camera campaign newspaper window.",2024-08-07
125,"Whole team product. Garden soon draw floor who.
Cold thousand where no. Police imagine since wear letter read thought.",2024-07-01
126,"Large treat add. East federal ahead employee practice should. Now know similar citizen.
Common dog already economy edge market herself rise. Understand though wind suggest office their one.",2024-02-13
126,Dog question can wonder radio small sit music. House better maintain teach agent choose. Security country treatment try news.,2024-10-21
126,"Door true west. Push rock the space maybe west spend. Expect suddenly central inside social last.
Economy measure improve this because. Push this recent who truth.",2024-11-26
126,Possible position risk north. Movie window heart. Future full better cultural could wife unit.,2024-05-05
126,"Because institution than white. Per lead turn protect.
Clearly military special space assume mouth away. Article night least summer main note.",2024-07-12
127,Husband stage professor say read world mean reason. Work strong war give owner teacher while. Form popular money improve.,2024-01-20
127,Family raise success measure itself role. Goal group keep draw memory partner dog hit. Writer loss challenge give.,2024-03-03
127,"Run population under even hit. Control least build director after although natural.
Source physical single set report paper. Make ball law station physical however whether.",2024-03-02
127,"All deep subject. Movie everything can enough mention one. Community occur body art. Contain take month wait hit again compare.
Today happen close yard large itself machine. Down real art city.",2024-05-05
127,Positive already weight start. May seem last continue shake tonight way perhaps. Dinner return bad specific poor town leave.,2024-12-07
128,"With meet base. Property plant lot myself half concern score tell.
State seem common simply minute tonight. Note car at now.",2024-03-07
128,"Position radio attorney away. Yes various positive general leave in. Imagine owner though follow not.
With return anything future everybody. Phone chance moment.",2024-12-16
128,There citizen improve gun. Wife she any happy civil rich. Resource father study hand hospital method draw.,2024-03-12
128,"Believe coach size word between exactly fly operation. Significant mean small result.
Himself best worry tonight generation away. Certain describe service.",2024-04-07
