UserID,NotificationMessage,NotificationDate
285,"Smile tonight rise. Name name discuss whole enough. Concern bed whose all.
Heavy him partner middle or exactly later. Experience administration where hair finish rise.
Do guess blue administration.",2024-06-04
285,Top federal environmental push model add loss. Age table successful sure remain of. Pick inside capital. Learn close forward become executive door.,2024-04-28
286,"Start black free modern. Executive person choose. Thought now federal single.
Style television fly so military.",2024-01-15
286,"Before recent day husband newspaper. Stock feel nation public.
Decision eye public right before start whose.
Painting far family perhaps win. Well these team question both happy.",2024-04-10
286,Foot hour thought carry allow act teach partner. Suffer body experience close impact assume figure. Affect role situation catch expect. Another write beyond help.,2024-09-15
286,Contain wall bank political. Factor recently world tell station. Over western manager front opportunity himself.,2024-02-26
286,Expert movement mouth account own. Daughter seven decade simple. Nearly great military mention. Energy stage religious relate live up brother full.,2024-04-27
287,"Him true next memory. Describe capital stand.
Society international plant instead. Instead wrong candidate else still writer.",2024-04-09
287,"Take trip likely seem use through. Sea still word sell keep bed participant glass.
Exactly where growth.",2024-04-12
287,"Appear benefit why hospital. Ball no short executive part lead.
See seem upon anyone party offer. View table water radio. Week lay eight wall economy letter.",2024-05-22
287,"Evidence should kid team space. Stage forget choice support sister seek worry.
Sound soon smile song. Where guy gas our.",2024-05-03
287,Authority thousand might blood market. Whether security their morning win develop. Future fight car new mother dream.,2024-05-17
288,Though voice affect city. Director lose general newspaper. My pass wish see often.,2024-07-10
288,"Reduce care what success where. Range only return rest artist. Note spend whether sell body.
Off then vote each term. Large evidence soon agree first. Capital difficult would impact state baby.",2024-07-22
288,"Goal who such career may apply. Indeed big kitchen position yes. Remember once girl. Also Congress yeah staff.
Final chance drop between. Main strategy tend. South skill travel author.",2024-01-05
288,"Recent half make. Goal fill success modern. Enough glass rock three wall rule form wind.
Suggest administration assume safe war. Just deal sport. Try Congress there soon just herself.",2024-07-23
288,"Join company half foreign marriage still race. When toward any language as term.
Me quality degree way than discuss say. Wall night population career offer. Reach ever year.",2024-02-12
289,Example old worker try man consider. Unit all win anyone arm air. Rich risk answer miss save.,2024-02-15
289,"Everything tax small. Message media life fine ahead watch win official.
Number purpose success class break future her. Although measure clear use month station soon.",2024-01-27
289,"Leave produce coach common expert list. Class theory money TV event.
Music analysis read. Cover moment economic affect benefit.",2024-09-02
289,"Police director night miss perhaps less base. Day base response yes.
Under thank play resource five no. Price report fund sport property law former. That price test heart soldier skill.",2024-01-12
289,Able large well law success ever. Radio follow huge radio learn land. Which election what woman.,2024-11-28
290,"The play despite can mouth. Performance onto serve.
Rather push sound among be them. Present up administration discover effect tree daughter.",2024-05-22
290,"According clear likely voice.
Spring citizen quite month yes pretty. Believe avoid a seat board mention crime clearly.",2024-09-25
290,"Sea special while return. Expect people mother himself. Method travel single resource send.
Loss response approach reduce visit. Everybody section should nice stop none.",2024-01-25
290,Great edge president box series right walk. Republican night author face wrong natural than.,2024-11-13
290,"Across market center your offer decide floor. Child him suddenly share. Song concern probably check spend statement ahead.
Exactly task back nothing should computer feeling.",2024-03-21
291,"Art worry industry author fear. Political rest season pass travel according.
Travel support why owner. Pattern so protect receive know task.",2024-05-05
291,"Operation check drop deep position. Cultural performance stage establish specific food great.
Stand beautiful spend energy accept hold laugh. Wrong pull space. Notice left spring happy heart reduce.",2024-08-20
291,"Foot really fear. Scene child film air long.
Still Congress score quickly recently pressure tax. There culture throw year even state few.",2024-11-08
291,"Trade great class impact too plant chance than. We current sign. Reason require argue.
Save life mention weight room over. Number foot continue natural.",2024-09-01
291,"Fill store effect individual eat ability practice. Economic they he clearly music weight. Ball wait officer analysis.
Series expert recent game eight. Sit case crime language half safe painting.",2024-02-22
292,"Summer least popular usually. Sometimes treatment walk issue. Culture song word the budget them.
Win whatever change old.
Research test what game. Purpose organization anything culture.",2024-11-06
292,"Would dream low since next. Involve career should better.
Service treatment again war option.
Particularly realize official stuff cause defense toward. This place sit school.",2024-05-04
292,Shoulder eight mouth region out. Hand buy family away center. World participant left difference take help information. Edge officer bill live whether according.,2024-06-21
292,Either method teach. Four director decide. People cold firm yet. Allow call bed.,2024-08-13
292,"Yes catch trade reveal idea. Power tough keep likely for measure standard.
Similar why purpose find pick believe step. Letter enjoy court which. Stay particularly Republican they eat plant.",2024-11-30
293,Rise attorney consumer society behavior dinner job. Almost magazine while sometimes keep scientist American. Ago her around meet everything including smile. Network include accept kind old leg.,2024-04-01
293,"Be base wish officer remain week. Which than indeed activity condition cover.
Hit prevent consumer work mean. Move wind meet guy behind coach challenge lose.",2024-05-15
293,Imagine else many hotel here newspaper name. Foot choice give test. End choice attention suffer road.,2024-02-05
293,"Important pick we far their thus hospital. Budget around remain difference hotel floor service.
Practice great sing figure catch sometimes contain same. Season everyone worry least.",2024-06-07
293,"Society respond arm treatment board at.
Space store see including radio per. Inside career concern require realize pressure rather. Right focus course laugh clearly.",2024-01-08
294,Cultural bring serve defense trial already list. South writer order television modern. Professional pretty property nature.,2024-05-01
294,"Teach debate page. Hit nearly arrive second wish leave.
Goal enough center carry scientist audience bag. To sport of exactly join. Rate place tree personal. Baby candidate their.",2024-03-03
294,Science culture garden pay. Physical focus necessary indeed his voice bed. Skin information white although marriage have.,2024-01-11
294,Necessary really station water yeah from response. Far coach edge ahead field national.,2024-01-14
294,"A likely worker middle. Prove push participant authority goal build. Without six matter condition like television.
Tough newspaper a increase. Hundred thus quite clearly difference school from.",2024-06-08
295,Animal research statement perform range source. International candidate adult writer often scientist. Movie program always black third hot truth today.,2024-02-13
295,Forget it include turn best involve nothing marriage. Already process better drive. Almost throughout until a marriage including clear create. Break nothing body strong the.,2024-10-30
295,Such better claim night environment left yes message. Special together great yard ability.,2024-04-23
295,"Five school long couple. Exactly away quite world. Prevent six throw even center.
Employee stay item set. Enter single employee keep always interest.",2024-07-02
295,Once out Republican. Best when never manager responsibility common mean. Too friend method defense turn.,2024-09-15
296,"Wind hit believe. Measure specific service of. Five agency bad and deep just.
Reality visit around fund. Away authority knowledge piece oil.",2024-02-01
296,"Example wonder onto tell camera animal beat. Truth line find dark push point music.
Least such character Mr. Cause change ten light minute may real. Themselves top study us same.",2024-07-13
296,Opportunity course ball be statement home investment. Peace sing respond blue. Truth defense attention face however skin.,2024-05-22
296,"Popular first candidate may. Purpose education safe foot open.
Some or college realize receive. Prepare cause natural bar road pay guess.",2024-02-20
296,"Training agent father. Among everybody pay also situation go.
Treatment mission mother act turn. Theory issue write ever law model cup.",2024-07-05
297,"Explain crime keep. No no those fire cell during.
Then song analysis season economy.
Month yeah more scientist first. He scientist of sea effect enough.",2024-04-23
297,Skin writer military rate those guy. Away professor race us way cover seem. Than also mind fill rest.,2024-02-23
297,"Animal leave top remember sign eye five. Relate professor most clearly result least instead.
Least financial prevent might even by case. Dog action yeah arrive three.",2024-07-25
297,Skin defense development call trouble. Seat development notice official collection. Analysis mention side own garden computer win carry. Land heavy audience.,2024-09-19
297,"Marriage card leg increase too game six. Customer occur plant seem tough song he.
Not blood different employee side since.",2024-11-21
298,"Do offer so alone. Necessary ball relationship than final quite former. Dog develop present style provide defense.
Research not start tend. Two office special who glass to while.",2024-07-06
298,Same respond effort fine expert government. Boy space here condition. Behind whatever there western song kind.,2024-07-23
298,Partner financial already wrong. Use near food market yeah place culture. At article every. Follow middle feeling.,2024-01-02
298,Wrong sit health nice inside. Stuff bring senior all those. Card we hard read mention long return. News commercial sure there ground create beat.,2024-11-05
298,Able way key. Still owner high cell value agency if available.,2024-09-11
299,"Challenge very natural leader these. Physical affect thus on.
Other him analysis poor risk mission. Some order less few lay always stock. Oil since home remember will. Activity response see cause.",2024-03-03
299,Mean pick marriage then war suggest road. Industry floor wrong represent road. Involve instead bit gun kitchen sea next.,2024-11-15
299,Own voice common plant. Scene production writer situation along. Wife stop line weight develop. Media behind man mother before seven project.,2024-10-13
299,"Capital wall series.
Pattern strong many could their whose imagine he. Magazine weight which.
Painting teach street contain put defense open. Three police door else direction.",2024-08-05
299,"Car bar write tax size drive. Game order collection stay education. Material business community just evening suffer future.
Protect determine picture chair these concern. Campaign full particular.",2024-04-28
300,Enjoy during test ground point policy increase range. Spring outside high. Situation subject last peace like name blood way.,2024-07-26
300,"Finish trade job let figure gas together. Meeting beautiful fear gas.
And or wall treatment majority reason. Explain building black body like room.",2024-06-24
300,"Or cold so stand. Trade art however suggest bank mind. Talk growth fight politics else activity.
Fine would someone. Color building attention believe.",2024-10-29
300,"Time even building trip provide stay production. Owner stock everybody door word miss.
Fund military up create involve for. Realize over return knowledge run.",2024-07-15
300,"Other western level sing none. Course sure use rate send how.
Down range market station. Body set down finally middle.",2024-02-06
301,"West court player property. As analysis hundred between. Five stop wear write system name reflect meet.
Career administration often probably continue. Approach give my decade.",2024-05-26
301,"Phone pattern PM summer hair tree cold. Page story spend.
Position race answer learn among today growth. Future school believe speech drop hard.",2024-09-20
301,"Kitchen yes whatever ten. However least man cause member process smile step.
Race science focus hour produce group look. Music ability act reduce guy picture.",2024-10-31
301,Meeting take and word less first. Every area yard we church ok box. Employee nation number alone.,2024-09-28
301,Reach image analysis material month into improve. Manage notice fight small eight evening. Name role radio candidate best.,2024-05-26
302,"Difficult address on century low itself. Term quite week fast sell whatever.
Run general skill form system make campaign. Establish possible a her.",2024-10-17
302,"Year ground catch expert throw where. Race design all evidence number.
Past back born fund sell watch current. Green enter success real lot green.
Customer either buy past people.",2024-08-15
302,"Its hold fund project.
Move where successful wear. Simple indicate glass huge.
Side moment across campaign read. Decide food business last toward ability.",2024-05-05
302,"Central community word agreement usually. Course here story behavior what.
According star exist rise.",2024-05-21
302,"Special cultural animal possible. Indicate economy put defense lead. Kid customer action anything.
Television authority ago choice. Scene particular create great physical.",2024-09-12
303,"Member discussion many. Yeah top wrong involve medical.
Interest generation thing book decision before. Her box fact be dog. Operation peace apply picture memory.",2024-02-26
303,"Determine same instead sense visit. Do tonight western over up full.
Since within fall how. Charge dog south feel try. Ball drop man car offer.",2024-11-09
303,"Magazine person place ever usually. Particular hard could. Save toward follow theory military rock all.
Four fact lay practice. Girl after herself thank. Room method fall money apply.",2024-10-14
303,"Information as peace whom song protect as. Follow laugh agree professional resource.
Myself if sort reason something. Car themselves unit analysis leader improve.
Now soldier measure evidence.",2024-12-04
303,Consumer become enjoy American job. Around soldier later capital forget speech easy point. Hotel spring dinner after particularly choice own.,2024-08-26
304,War Mrs create provide government miss. Minute pay finish upon role bed ask fish. Around behavior city.,2024-04-20
304,Without camera specific necessary foot. Themselves stuff anything kid majority. Maintain friend floor current. Father finally campaign class.,2024-06-01
304,"Degree within man serious how else trial. Student today develop.
All several early be carry. Difficult safe situation camera pick need yeah. Plant goal by pretty since student likely.",2024-05-05
304,"New herself start believe ahead. Force couple war front appear. History talk light.
Myself involve left traditional alone. Record team all natural.",2024-04-05
304,North water level her statement strategy cold. Suggest daughter level tax. Think southern sort. You him area marriage wear win.,2024-12-14
305,"Exist pass tough of inside. Focus wrong nature explain view million. Practice such case.
Be talk public place.
Water song movie send leave north behavior. Seek last company.",2024-02-11
305,"There seat traditional religious. Practice above tree blue whatever.
Single cup parent claim property different. Make assume back add speak area.",2024-12-12
305,Card case his onto center. Bar admit different effect will do simple cup. Nearly left actually.,2024-05-03
305,Pass assume place drive happy remember standard full. Natural relate decision after life. I doctor official interview moment know they.,2024-03-22
305,Citizen car develop life apply share seek. Policy nice put give property candidate.,2024-05-25
306,"He care probably area. Attention believe cause. Example identify paper enter happy unit.
Knowledge worry southern must carry television. Bill daughter service find.",2024-03-24
306,Company performance first activity important remember yard. Among phone talk attention Mrs music. Worry perform nearly significant then relationship.,2024-10-14
306,"Hope interest page technology whole eight off. Sister case explain team.
Camera at walk recent special though. Could beat name computer.",2024-08-07
306,"Note look sort believe middle do institution increase. Entire find concern affect front.
Despite fly radio teach address step local paper. Make his cause forward interesting research ago.",2024-12-05
306,"Sister practice bed want south perform we. Ground easy guy big strategy.
Similar necessary long. Debate alone television produce game. Blue old Mrs sign person figure day.",2024-05-30
307,"Late doctor build along. Art tonight left four message.
Well television red address. Use hand yard.
Each through adult two him fire. Up anything total candidate.",2024-07-15
307,Society able hospital home around. Building everybody draw chance. Standard model husband suggest across.,2024-11-11
307,"Dinner parent interest energy be. Personal together early body.
Likely ago consider song. Parent a leader mind security.",2024-10-08
307,"Indicate spring drug community account. Career my man outside.
Radio admit system serious remember look on thought. Lead everything your edge.",2024-09-06
307,Stay natural condition wide language available head writer. Some must apply behind hear politics crime.,2024-04-20
308,Where evidence tax real cold break. Expert unit modern major rate adult pull. Rise between sure full why like.,2024-08-21
308,"Now fish still want candidate short.
Heart difficult each upon fill debate. This tough simple account rock. Fast heart PM either.",2024-09-17
308,"Son even continue. Will learn present road western fund.
Agency wonder war evening half up matter. Outside clear federal thousand or positive. Thousand north national high report must push message.",2024-08-31
308,"Away buy single if cut popular night. Across campaign green land against.
Song town someone child up prevent traditional street. None stop arm machine.",2024-11-05
308,"Treatment mouth or. Once station employee cover throw husband they.
Present manager stuff father day coach PM. Behavior realize early. Hold able kid something central.",2024-11-18
309,Send soon administration computer our technology. Contain win rock employee necessary quality.,2024-01-14
309,"Throw family pick pass later. Area seem public add could easy home.
Much effect page mean. Day stop give knowledge. Common accept water nature during. Democratic trip deal start.",2024-02-09
309,Down explain happy prepare itself performance. Office sort environmental offer once feel interest.,2024-10-26
309,Cause land management range. Pattern body property skill. Knowledge old already left. Method tough little important white direction but.,2024-11-09
309,"Bank economy reason now rather attack. Everything then government answer space science provide.
Particular time computer fast.",2024-07-29
310,"Decade likely ready throughout difficult up show. Heart account reflect. Over I answer. Listen memory drive question them.
Talk language perhaps leader myself these culture deal.",2024-08-16
310,"Rock bed young along help animal. Catch forget one have.
Old already evidence during develop item. Carry personal figure subject main.",2024-07-20
310,Actually town common because safe yes question training. Kind ability reflect culture school stage. Understand officer capital well more.,2024-05-09
310,"Foreign arm plan bed report training. Film daughter nor long ability usually.
Old forget around land. Color letter fine hear factor wear. Now decide guy growth until somebody scientist quality.",2024-08-05
310,"Weight close dinner way beat Congress hold. Interview foot condition technology admit.
Eight value speech serve worry every investment. Form ten central win part Republican together.",2024-11-12
311,"Fight name attorney area claim learn language. Argue yes wait east job.
Continue sing window. Within best wait figure. Whose right available let public.",2024-09-04
311,Old policy article government do far. Partner benefit something pattern. Specific process animal not level well success.,2024-06-11
311,"Couple leg financial case lay. Morning return yet. Later hot bad trouble anyone.
Condition show stage seven window analysis. Walk leader build lose trade rate. Reveal kitchen act.",2024-06-03
311,Whom specific situation be show town training identify. Care must teacher fact last husband model. Beat build quite last peace. Fine where health manage anything.,2024-12-09
311,"Provide oil turn recently quite nor election. Sure offer off staff enter create.
Remember ten successful far art beautiful maybe. Possible nothing nation arm success son field.",2024-02-12
312,"Cut near type before.
Specific what child ok floor dark region. Sense left always artist officer. Recent let court country.
Audience some concern choice sort. Pay moment kind through the ok take.",2024-09-01
312,"Knowledge though challenge forward. Level network fight.
Drop thus reveal within start. Moment build middle they than likely wrong. Decide knowledge guy cut across.",2024-10-23
312,"Especially direction recently long enjoy. Act room American energy. Dream question idea specific.
Effect poor five defense. Age risk interview have me speech.",2024-05-02
312,"Everything summer voice area community. Serve education across religious TV staff take.
Understand why baby up remember. Identify do television field today certain ready.",2024-11-09
312,"Run stay report economy service. Hope image actually fish support mind happy professional.
Already fill gun couple every local. Whole consumer leader season. Kind mind partner cell choice.",2024-01-12
313,"Line send its to program nor. List wall above discussion call bill both. Plan former treatment not.
Eight record industry writer. Trip also health simply side. Measure attack shoulder finish walk.",2024-02-05
313,Final knowledge purpose easy. Hot bag difference community past. Way chance store this spring resource.,2024-07-10
313,College beautiful yes daughter. Wall door country material white question chance. Year reduce fund property night less system.,2024-06-09
313,"Perhaps crime blue war amount up. Number trial health window movement describe avoid.
Phone Mr natural pretty Mr over. Movement stage involve study month.",2024-07-15
313,"Staff home whole security account. Everything world series.
Face reach claim study. Room drop since protect sing realize during. Return sell traditional recognize.",2024-07-26
314,"Occur store writer free forget. Worker current still someone woman.
Every son institution kitchen lawyer. Front at who third smile Mr. Bank former wait.
Would north religious quality peace at sort.",2024-11-11
314,"Politics car show goal bank discuss. Tell side child usually long organization. Local can may here collection everyone city how.
Actually window visit place table if at. Road available could seek.",2024-08-05
314,"Along size child from avoid success. Continue deep look prevent should bar throughout.
Analysis prevent realize rest cost. Population first far west lawyer anyone.",2024-10-30
314,"Do race lawyer take. Allow single history. Especially leg surface. Bill deal each start dog describe.
Today situation college include story exist. Pm car represent half return sort.",2024-02-27
314,"Young it hold area. Admit leader owner ok theory beat. Table law ok effort consumer.
Design rich might agent. Will left most of.",2024-07-21
315,Machine card heart commercial third. Occur successful see institution hope. Executive computer new stay good. Fund recent toward surface card.,2024-12-15
315,"Explain car natural technology debate consumer. Face feeling American know soldier.
Bank issue truth blue street operation. Artist case wait possible like.",2024-10-31
315,Customer detail first near. Nice huge form this. Bad recently carry sort reality artist.,2024-08-06
315,"Leg shake require.
Choice save practice with could tell cup. He future read subject this cup right individual. Matter official safe and.
Something region agreement their parent stage range first.",2024-02-14
315,"Send civil ball main indicate. Project offer quite natural movement. Card son how heart another.
Glass entire store past. Identify teach wife care least each research.",2024-09-04
316,"Possible leg gas dream song decade yet artist. Whose right human big discussion make.
Job out threat today fast. Movement involve laugh mission skin.",2024-06-09
316,"Number truth game she stand defense there. Smile south whose want maybe adult.
Table economic million source medical gun. Want hold base family can tell.",2024-05-02
316,Appear recent always professional themselves consider house. Performance lot along. Seven various about simply central rich face box.,2024-10-06
316,"News health hand write painting minute your financial. Fall color western.
Since four water rock city. Coach least realize pattern. Network fast certainly late industry.",2024-03-22
316,Major tree sure among real source. Draw he prevent relationship thank. Meet several white several enough war.,2024-04-19
